{
  "schema_version": "1.0",
  "task_id": null,
  "goal": null,
  "acceptance_criteria": [],
  "constraints": [],
  "decisions": [],
  "completed": [],
  "unverified": [],
  "remaining": [],
  "blockers": [],
  "artifacts": [],
  "authorization_notes": [],
  "next_action": null,
  "updated_at": null
}
